[
  {
    "id": "33333333-3333-4333-8333-333333333333",
    "siteId": "11111111-1111-4111-8111-111111111111",
    "code": "C-01",
    "name": "Cuve C-01",
    "capacityLiters": 10000,
    "currentVolumeLiters": 7200,
    "contentLotId": "66666666-6666-4666-8666-666666666666",
    "status": "occupied",
    "material": "inox",
    "zone": "Nord",
    "position": { "x": 8, "y": 16 },
    "sensors": ["temp-c01", "ph-c01"],
    "createdAt": "2026-05-18T09:00:00.000Z",
    "updatedAt": "2026-05-18T09:00:00.000Z"
  },
  {
    "id": "55555555-5555-4555-8555-555555555555",
    "siteId": "11111111-1111-4111-8111-111111111111",
    "code": "C-02",
    "name": "Cuve C-02",
    "capacityLiters": 8000,
    "currentVolumeLiters": 1800,
    "status": "occupied",
    "material": "inox",
    "zone": "Nord",
    "position": { "x": 42, "y": 18 },
    "sensors": ["temp-c02"],
    "createdAt": "2026-05-18T09:00:00.000Z",
    "updatedAt": "2026-05-18T09:00:00.000Z"
  }
]

